{
  "$schema": "./schema/economy.schema.json",
  "rarities": {
    "common": { "deckLimit": 3, "duplicatePct": 2 },
    "uncommon": { "deckLimit": 3, "duplicatePct": 4 },
    "rare": { "deckLimit": 3, "duplicatePct": 8 },
    "epic": { "deckLimit": 3, "duplicatePct": 16 },
    "legendary": { "deckLimit": 2, "duplicatePct": 40 },
    "mythic": { "deckLimit": 1, "duplicatePct": 80 },
    "ancient": { "deckLimit": 1, "duplicatePct": 200 }
  },
  "packs": [
    {
      "id": "standard",
      "name": "Standart",
      "priceMult": 1,
      "cards": 5,
      "smart": true,
      "odds": { "common": 55, "uncommon": 25, "rare": 12, "epic": 5, "legendary": 3 }
    },
    {
      "id": "element",
      "name": "Element",
      "priceMult": 1.5,
      "cards": 5,
      "element": true,
      "odds": { "common": 55, "uncommon": 25, "rare": 12, "epic": 5, "legendary": 3 }
    },
    {
      "id": "lucky",
      "name": "Şanslı",
      "priceMult": 2.5,
      "cards": 5,
      "guarantee": { "rarityAtLeast": "rare", "count": 1 },
      "odds": { "common": 35, "uncommon": 28, "rare": 22, "epic": 10, "legendary": 5 }
    },
    {
      "id": "sealed",
      "name": "Mühürlü",
      "priceMult": 6,
      "cards": 5,
      "guarantee": { "rarityAtLeast": "epic", "count": 1 },
      "odds": { "rare": 50, "epic": 35, "legendary": 15 }
    }
  ],
  "packBasePrice": 120,
  "basePack": "standard",
  "pity": { "packsWithoutRarePlus": 6 },
  "timing": { "planningSecPerRound": 40, "secPerStep": 0.5 },
  "expedition": {
    "rations": 2,
    "restHealPct": 35,
    "speedBonusPct": 10,
    "streakBonusPct": 10,
    "bagLossPct": 50,
    "woundCarryPct": 25,
    "siegeNightHealPct": 100,
    "essenceByRarity": { "common": 40, "uncommon": 60, "rare": 100, "epic": 160, "legendary": 300, "mythic": 500, "ancient": 800 }
  }
}
